id,title,date,badges,description,image,content
product-growth-playbook,The Complete Product Growth Playbook,2026-02-10,product;SaaS;management;research,"A complete, real-world guide to building, scaling, and sustaining product growth in modern SaaS companies.",https://images.unsplash.com/photo-1556157382-97eda2d62296,"Product growth is driven by deep user understanding, experimentation, analytics, and cross-functional collaboration. Product growth is driven by deep user understanding, experimentation, analytics, and cross-functional collaboration. Product growth is driven by deep user understanding, experimentation, analytics, and cross-functional collaboration. Product growth is driven by deep user understanding, experimentation, analytics, and cross-functional collaboration. Product growth is driven by deep user understanding, experimentation, analytics, and cross-functional collaboration. Product growth is driven by deep user understanding, experimentation, analytics, and cross-functional collaboration. Product growth is driven by deep user understanding, experimentation, analytics, and cross-functional collaboration. Product growth is driven by deep user understanding, experimentation, analytics, and cross-functional collaboration. Product growth is driven by deep user understanding, experimentation, analytics, and cross-functional collaboration. Product growth is driven by deep user understanding, experimentation, analytics, and cross-functional collaboration. "
modern-leadership,Modern Leadership Principles,2026-01-20,leadership;management,Key leadership principles for managing modern tech teams.,https://images.unsplash.com/photo-1521737604893-d14cc237f11d,"Modern leadership requires empathy, clarity, trust, and continuous learning. Modern leadership requires empathy, clarity, trust, and continuous learning. Modern leadership requires empathy, clarity, trust, and continuous learning. Modern leadership requires empathy, clarity, trust, and continuous learning. Modern leadership requires empathy, clarity, trust, and continuous learning. Modern leadership requires empathy, clarity, trust, and continuous learning. Modern leadership requires empathy, clarity, trust, and continuous learning. Modern leadership requires empathy, clarity, trust, and continuous learning. Modern leadership requires empathy, clarity, trust, and continuous learning. Modern leadership requires empathy, clarity, trust, and continuous learning. "
customer-success-playbook,Customer Success Playbook,2026-01-05,customer-success;SaaS;management,A tactical guide to building scalable customer success operations.,https://images.unsplash.com/photo-1556761175-4b46a572b786,Customer success focuses on enabling customers to achieve meaningful outcomes. Customer success focuses on enabling customers to achieve meaningful outcomes. Customer success focuses on enabling customers to achieve meaningful outcomes. Customer success focuses on enabling customers to achieve meaningful outcomes. Customer success focuses on enabling customers to achieve meaningful outcomes. Customer success focuses on enabling customers to achieve meaningful outcomes. Customer success focuses on enabling customers to achieve meaningful outcomes. Customer success focuses on enabling customers to achieve meaningful outcomes. Customer success focuses on enabling customers to achieve meaningful outcomes. Customer success focuses on enabling customers to achieve meaningful outcomes. 
product-strategy-framework,Product Strategy Framework,2025-12-15,product;research;management,A comprehensive framework for defining product strategy.,https://images.unsplash.com/photo-1504384308090-c894fdcc538d,Effective product strategy aligns business goals with user needs. Effective product strategy aligns business goals with user needs. Effective product strategy aligns business goals with user needs. Effective product strategy aligns business goals with user needs. Effective product strategy aligns business goals with user needs. Effective product strategy aligns business goals with user needs. Effective product strategy aligns business goals with user needs. Effective product strategy aligns business goals with user needs. Effective product strategy aligns business goals with user needs. Effective product strategy aligns business goals with user needs. 
essential-tools-stack,Essential Tools Stack,2025-11-25,tools;frameworks;SaaS,A curated list of modern tools for high-performance teams.,https://images.unsplash.com/photo-1558655146-d09347e92766,Modern teams rely on efficient tools for communication and collaboration. Modern teams rely on efficient tools for communication and collaboration. Modern teams rely on efficient tools for communication and collaboration. Modern teams rely on efficient tools for communication and collaboration. Modern teams rely on efficient tools for communication and collaboration. Modern teams rely on efficient tools for communication and collaboration. Modern teams rely on efficient tools for communication and collaboration. Modern teams rely on efficient tools for communication and collaboration. Modern teams rely on efficient tools for communication and collaboration. Modern teams rely on efficient tools for communication and collaboration. 
